{
  "schema_version": "1.0",
  "profile_id": "host-unsandboxed-mac-engineering-v1",
  "profile_version": 2,
  "content_hash": "sha256:441fe2c7e79efe2f0f080dcc21026a83dcbd4614c0287a69e1509839648c4014",
  "description": "Phase 3 engineering worker on the trusted macOS host. Source edits are confined to one dedicated checkout; LTVM lifecycle is controller-brokered and command execution is open-ended only inside exact-owner guests. Service writes remain disabled.",
  "supported_hosts": {"operating_systems": ["Darwin"], "architectures": ["arm64"]},
  "runtimes": {
    "claude_code": "==2.1.251", "node": ">=25.6,<26", "python": ">=3.9,<3.13",
    "git": ">=2.39", "worker_protocol": "==1.0"
  },
  "tools": [
    {"name": "claude_code", "command": "claude", "required": true, "version_constraint": "==2.1.251", "expected_path": "/opt/homebrew/bin/claude"},
    {"name": "node", "command": "node", "required": true, "version_constraint": ">=25.6,<26", "expected_path": "/opt/homebrew/bin/node"},
    {"name": "python", "command": "python3", "required": true, "version_constraint": ">=3.9,<3.13", "expected_path": "/usr/bin/python3"},
    {"name": "git", "command": "git", "required": true, "version_constraint": ">=2.39", "expected_path": "/usr/bin/git"},
    {"name": "rg", "command": "rg", "required": true, "expected_path": "/Applications/ChatGPT.app/Contents/Resources/rg"},
    {"name": "jq", "command": "jq", "required": true, "expected_path": "/usr/bin/jq"},
    {"name": "pw_worker", "command": "pw-worker", "required": true, "api_version": "1.0"},
    {"name": "ltvm", "command": "ltvm", "required": false, "version_constraint": "==0.20.01146e5", "api_version": "0.20", "expected_path": "/usr/local/bin/ltvm"}
  ],
  "capabilities": [
    "edit_source", "read_evidence", "read_source", "register_artifact",
    "report_status", "request_validation", "run_vm_tests", "start_ltvm"
  ],
  "isolation_profiles": ["host_unsandboxed"],
  "network_profiles": ["host_ambient"],
  "logical_paths": {
    "/home/worker": "private_read_write", "/run/patch-watcher": "private_read_write",
    "/work/input": "private_read_only", "/work/output": "private_read_write",
    "/work/scratch": "private_read_write", "/work/source": "private_read_write"
  },
  "host_services": ["artifact_collector", "claude_runner", "ltvm_guest_broker", "resource_sampler", "worker_report_channel"],
  "default_limits": {
    "action_count": 50, "cpu_count": 4, "disk_bytes": 21474836480,
    "inactivity_seconds": 1800, "memory_bytes": 8589934592,
    "output_bytes": 1073741824, "process_count": 256, "runtime_seconds": 172800
  },
  "ambient_home_allowed": true,
  "security_label": "trusted_unsandboxed"
}
